12:58:37.400277 IP cran.wu-wien.ac.at.ssh > host31.natpool.mwn.de.38393: P 4086863960:4086864152(192) ack 955610478 win 3228 <nop,nop,timestamp 92827717 2196611>
12:58:37.400533 IP oberplag.ser.de.44909 > cran.wu-wien.ac.at.www: . ack 4092616412 win 63712 <nop,nop,timestamp 821421183 92827715>
12:58:37.400563 IP cran.wu-wien.ac.at.www > oberplag.ser.de.44909: . 5793:8689(2896) ack 0 win 1716 <nop,nop,timestamp 92827717 821421183>
12:58:37.400573 IP ds11.internetdsl.tpnet.pl.40263 > cran.wu-wien.ac.at.www: . ack 4130405206 win 2959 <nop,nop,timestamp 219051242 92827710>
12:58:37.400671 IP cran.wu-wien.ac.at.32879 > ns3.wu-wien.ac.at.domain:  12188+ PTR? 31.7.246.138.in-addr.arpa. (43)
12:58:37.401232 IP ns3.wu-wien.ac.at.domain > cran.wu-wien.ac.at.32879:  12188 1/3/5 (252)
12:58:37.401394 IP cran.wu-wien.ac.at.32879 > ns3.wu-wien.ac.at.domain:  12189+ PTR? 37.57.208.137.in-addr.arpa. (44)
12:58:37.401946 IP ns3.wu-wien.ac.at.domain > cran.wu-wien.ac.at.32879:  12189* 1/3/4 (213)
12:58:37.402065 IP cran.wu-wien.ac.at.32879 > ns3.wu-wien.ac.at.domain:  12190+ PTR? 156.156.225.62.in-addr.arpa. (45)
12:58:37.420368 IP oberplag.ser.de.44909 > cran.wu-wien.ac.at.www: . ack 2897 win 63712 <nop,nop,timestamp 821421185 92827717>
12:58:37.420387 IP cran.wu-wien.ac.at.www > oberplag.ser.de.44909: P 8689:10137(1448) ack 0 win 1716 <nop,nop,timestamp 92827719 821421185>
12:58:37.420785 IP oberplag.ser.de.44909 > cran.wu-wien.ac.at.www: . ack 5793 win 63712 <nop,nop,timestamp 821421185 92827717>
12:58:37.420803 IP cran.wu-wien.ac.at.www > oberplag.ser.de.44909: . 10137:14481(4344) ack 0 win 1716 <nop,nop,timestamp 92827719 821421185>
12:58:37.421552 IP oberplag.ser.de.44909 > cran.wu-wien.ac.at.www: . ack 8689 win 63712 <nop,nop,timestamp 821421185 92827717>
12:58:37.421570 IP cran.wu-wien.ac.at.www > oberplag.ser.de.44909: . 14481:18825(4344) ack 0 win 1716 <nop,nop,timestamp 92827719 821421185>
12:58:37.425070 IP host31.natpool.mwn.de.38393 > cran.wu-wien.ac.at.ssh: . ack 192 win 3892 <nop,nop,timestamp 2196662 92827717>
12:58:37.440031 IP 193.204.15.29.49311 > cran.wu-wien.ac.at.www: P ack 2477630492 win 65535
12:58:37.440589 IP ds11.internetdsl.tpnet.pl.40263 > cran.wu-wien.ac.at.www: . ack 8689 win 787 <nop,nop,timestamp 219051291 92827710>
12:58:37.440608 IP cran.wu-wien.ac.at.www > ds11.internetdsl.tpnet.pl.40263: . 8689:11837(3148) ack 0 win 1716 <nop,nop,timestamp 92827721 219051291>
12:58:37.441578 IP oberplag.ser.de.44909 > cran.wu-wien.ac.at.www: . ack 11585 win 63712 <nop,nop,timestamp 821421187 92827719>
12:58:37.442181 IP oberplag.ser.de.44909 > cran.wu-wien.ac.at.www: . ack 14481 win 63712 <nop,nop,timestamp 821421187 92827719>
12:58:37.442200 IP cran.wu-wien.ac.at.www > oberplag.ser.de.44909: . 18825:24617(5792) ack 0 win 1716 <nop,nop,timestamp 92827722 821421187>
12:58:37.443215 IP oberplag.ser.de.44909 > cran.wu-wien.ac.at.www: . ack 17377 win 63712 <nop,nop,timestamp 821421187 92827719>
12:58:37.454232 IP 193.204.15.29.49311 > cran.wu-wien.ac.at.www: . ack 2737 win 65535 <nop,nop,timestamp 956225736 92827477>
12:58:37.462782 IP oberplag.ser.de.44909 > cran.wu-wien.ac.at.www: . ack 20273 win 63712 <nop,nop,timestamp 821421189 92827719>
12:58:37.462805 IP cran.wu-wien.ac.at.www > oberplag.ser.de.44909: . 24617:30409(5792) ack 0 win 1716 <nop,nop,timestamp 92827724 821421189>
12:58:37.463456 IP oberplag.ser.de.44909 > cran.wu-wien.ac.at.www: . ack 23169 win 63712 <nop,nop,timestamp 821421189 92827722>
12:58:37.465526 IP ns3.wu-wien.ac.at.domain > cran.wu-wien.ac.at.32879:  12190 2/3/3[|domain]
12:58:37.465670 IP cran.wu-wien.ac.at.32879 > ns3.wu-wien.ac.at.domain:  12191+ PTR? 11.254.53.80.in-addr.arpa. (43)
12:58:37.467040 IP 246.062.dsl.syd.iprimus.net.au.49432 > cran.wu-wien.ac.at.www: . ack 3523801196 win 65535 <nop,nop,timestamp 2039312105 92827616>
12:58:37.483985 IP oberplag.ser.de.44909 > cran.wu-wien.ac.at.www: . ack 26065 win 63712 <nop,nop,timestamp 821421191 92827722>
12:58:37.484006 IP cran.wu-wien.ac.at.www > oberplag.ser.de.44909: . 30409:36201(5792) ack 0 win 1716 <nop,nop,timestamp 92827726 821421191>
12:58:37.484423 IP oberplag.ser.de.44909 > cran.wu-wien.ac.at.www: . ack 28961 win 63712 <nop,nop,timestamp 821421191 92827724>
12:58:37.501594 IP ns3.wu-wien.ac.at.domain > cran.wu-wien.ac.at.32879:  12191 1/3/3 (184)
12:58:37.501703 IP cran.wu-wien.ac.at.32879 > ns3.wu-wien.ac.at.domain:  12192+ PTR? 3.3.208.137.in-addr.arpa. (42)
12:58:37.502296 IP ns3.wu-wien.ac.at.domain > cran.wu-wien.ac.at.32879:  12192* 1/3/4 PTR[|domain]
12:58:37.502487 IP cran.wu-wien.ac.at.32879 > ns3.wu-wien.ac.at.domain:  12193+ PTR? 29.15.204.193.in-addr.arpa. (44)
12:58:37.504639 IP oberplag.ser.de.44909 > cran.wu-wien.ac.at.www: . ack 31857 win 63712 <nop,nop,timestamp 821421193 92827724>
12:58:37.504663 IP cran.wu-wien.ac.at.www > oberplag.ser.de.44909: . 36201:41993(5792) ack 0 win 1716 <nop,nop,timestamp 92827728 821421193>
12:58:37.505315 IP oberplag.ser.de.44909 > cran.wu-wien.ac.at.www: . ack 34753 win 63712 <nop,nop,timestamp 821421193 92827726>
12:58:37.505332 IP cran.wu-wien.ac.at.www > oberplag.ser.de.44909: . 41993:46337(4344) ack 0 win 1716 <nop,nop,timestamp 92827728 821421193>
12:58:37.525315 IP oberplag.ser.de.44909 > cran.wu-wien.ac.at.www: . ack 37649 win 63712 <nop,nop,timestamp 821421195 92827726>
12:58:37.525768 IP oberplag.ser.de.44909 > cran.wu-wien.ac.at.www: . ack 40545 win 63712 <nop,nop,timestamp 821421195 92827728>
12:58:37.525786 IP cran.wu-wien.ac.at.www > oberplag.ser.de.44909: . 46337:52129(5792) ack 0 win 1716 <nop,nop,timestamp 92827730 821421195>
12:58:37.526387 IP oberplag.ser.de.44909 > cran.wu-wien.ac.at.www: . ack 43441 win 63712 <nop,nop,timestamp 821421195 92827728>
12:58:37.526977 IP oberplag.ser.de.44909 > cran.wu-wien.ac.at.www: . ack 46337 win 63712 <nop,nop,timestamp 821421195 92827728>
12:58:37.526995 IP cran.wu-wien.ac.at.www > oberplag.ser.de.44909: . 52129:57921(5792) ack 0 win 1716 <nop,nop,timestamp 92827730 821421195>
12:58:37.546719 IP oberplag.ser.de.44909 > cran.wu-wien.ac.at.www: . ack 49233 win 63712 <nop,nop,timestamp 821421197 92827730>
12:58:37.547618 IP oberplag.ser.de.44909 > cran.wu-wien.ac.at.www: . ack 52129 win 63712 <nop,nop,timestamp 821421198 92827730>
12:58:37.547636 IP cran.wu-wien.ac.at.www > oberplag.ser.de.44909: . 57921:63713(5792) ack 0 win 1716 <nop,nop,timestamp 92827732 821421198>
12:58:37.548127 IP oberplag.ser.de.44909 > cran.wu-wien.ac.at.www: . ack 55025 win 63712 <nop,nop,timestamp 821421198 92827730>
12:58:37.549289 IP oberplag.ser.de.44909 > cran.wu-wien.ac.at.www: . ack 57921 win 63712 <nop,nop,timestamp 821421198 92827730>
12:58:37.549310 IP cran.wu-wien.ac.at.www > oberplag.ser.de.44909: . 63713:70953(7240) ack 0 win 1716 <nop,nop,timestamp 92827732 821421198>
12:58:37.552843 IP 193.204.15.29.49311 > cran.wu-wien.ac.at.www: . ack 4105 win 65535 <nop,nop,timestamp 956225736 92827477>
12:58:37.552859 IP cran.wu-wien.ac.at.www > 193.204.15.29.49311: . 4105:5473(1368) ack 0 win 1716 <nop,nop,timestamp 92827733 956225736>
12:58:37.556255 IP ds11.internetdsl.tpnet.pl.40263 > cran.wu-wien.ac.at.www: . ack 11585 win 1436 <nop,nop,timestamp 219051378 92827721>
12:58:37.556276 IP cran.wu-wien.ac.at.www > ds11.internetdsl.tpnet.pl.40263: . 11837:17329(5492) ack 0 win 1716 <nop,nop,timestamp 92827733 219051378>
12:58:37.556935 IP ns3.wu-wien.ac.at.domain > cran.wu-wien.ac.at.32879:  12193 NXDomain 0/1/0 (101)
12:58:37.557110 IP cran.wu-wien.ac.at.32879 > ns3.wu-wien.ac.at.domain:  12194+ PTR? 246.252.27.211.in-addr.arpa. (45)
12:58:37.562607 IP px4.hitachi.co.jp.14462 > cran.wu-wien.ac.at.www: P 378779690:378780218(528) ack 4102621188 win 7604
12:58:37.562744 IP cran.wu-wien.ac.at.www > px4.hitachi.co.jp.14462: P 1:576(575) ack 528 win 15008
12:58:37.567781 802.1d unknown version
12:58:37.568699 IP oberplag.ser.de.44909 > cran.wu-wien.ac.at.www: . ack 60817 win 63712 <nop,nop,timestamp 821421200 92827732>
12:58:37.569287 IP oberplag.ser.de.44909 > cran.wu-wien.ac.at.www: . ack 63713 win 63712 <nop,nop,timestamp 821421200 92827732>
12:58:37.569304 IP cran.wu-wien.ac.at.www > oberplag.ser.de.44909: P 70953:73849(2896) ack 0 win 1716 <nop,nop,timestamp 92827734 821421200>
12:58:37.570481 IP oberplag.ser.de.44909 > cran.wu-wien.ac.at.www: . ack 66609 win 63712 <nop,nop,timestamp 821421200 92827732>
12:58:37.570499 IP cran.wu-wien.ac.at.www > oberplag.ser.de.44909: . 73849:79641(5792) ack 0 win 1716 <nop,nop,timestamp 92827734 821421200>
12:58:37.571178 IP oberplag.ser.de.44909 > cran.wu-wien.ac.at.www: . ack 69505 win 63712 <nop,nop,timestamp 821421200 92827732>
12:58:37.573713 IP info.ugm.ac.id.50793 > cran.wu-wien.ac.at.rsync: . ack 3056750104 win 32423 <nop,nop,timestamp 2516965797 92827531,nop,nop,sack sack 1 {4345:5793} >
12:58:37.573735 IP cran.wu-wien.ac.at.rsync > info.ugm.ac.id.50793: . 1:1449(1448) ack 0 win 0 <nop,nop,timestamp 92827735 2516965797>
12:58:37.573743 IP info.ugm.ac.id.50793 > cran.wu-wien.ac.at.rsync: . ack 1 win 32423 <nop,nop,timestamp 2516965797 92827531,nop,nop,sack sack 1 {4345:7241} >
12:58:37.573758 IP cran.wu-wien.ac.at.rsync > info.ugm.ac.id.50793: . 1449:2897(1448) ack 0 win 0 <nop,nop,timestamp 92827735 2516965797>
12:58:37.579717 IP 246.062.dsl.syd.iprimus.net.au.49432 > cran.wu-wien.ac.at.www: . ack 4285 win 65535 <nop,nop,timestamp 2039312105 92827616>
12:58:37.589979 IP oberplag.ser.de.44909 > cran.wu-wien.ac.at.www: . ack 72401 win 63712 <nop,nop,timestamp 821421202 92827732>
12:58:37.589999 IP cran.wu-wien.ac.at.www > oberplag.ser.de.44909: . 79641:85433(5792) ack 0 win 1716 <nop,nop,timestamp 92827736 821421202>
12:58:37.590598 IP oberplag.ser.de.44909 > cran.wu-wien.ac.at.www: . ack 75297 win 63712 <nop,nop,timestamp 821421202 92827734>
12:58:37.591312 IP oberplag.ser.de.44909 > cran.wu-wien.ac.at.www: . ack 78193 win 63712 <nop,nop,timestamp 821421202 92827734>
12:58:37.591330 IP cran.wu-wien.ac.at.www > oberplag.ser.de.44909: . 85433:91225(5792) ack 0 win 1716 <nop,nop,timestamp 92827736 821421202>
12:58:37.607173 IP ds11.internetdsl.tpnet.pl.40263 > cran.wu-wien.ac.at.www: . ack 11837 win 1373 <nop,nop,timestamp 219051428 92827721>
12:58:37.610291 IP oberplag.ser.de.44909 > cran.wu-wien.ac.at.www: . ack 81089 win 63712 <nop,nop,timestamp 821421204 92827734>
12:58:37.611253 IP oberplag.ser.de.44909 > cran.wu-wien.ac.at.www: . ack 83985 win 63712 <nop,nop,timestamp 821421204 92827736>
12:58:37.611272 IP cran.wu-wien.ac.at.www > oberplag.ser.de.44909: . 91225:97017(5792) ack 0 win 1716 <nop,nop,timestamp 92827738 821421204>
12:58:37.611836 IP oberplag.ser.de.44909 > cran.wu-wien.ac.at.www: . ack 86881 win 63712 <nop,nop,timestamp 821421204 92827736>
12:58:37.612729 IP oberplag.ser.de.44909 > cran.wu-wien.ac.at.www: . ack 89777 win 63712 <nop,nop,timestamp 821421204 92827736>
12:58:37.612749 IP cran.wu-wien.ac.at.www > oberplag.ser.de.44909: . 97017:104257(7240) ack 0 win 1716 <nop,nop,timestamp 92827739 821421204>
12:58:37.631797 IP oberplag.ser.de.44909 > cran.wu-wien.ac.at.www: . ack 92673 win 63712 <nop,nop,timestamp 821421206 92827736>
12:58:37.631812 IP cran.wu-wien.ac.at.www > oberplag.ser.de.44909: . 104257:105705(1448) ack 0 win 1716 <nop,nop,timestamp 92827740 821421206>
12:58:37.632542 IP oberplag.ser.de.44909 > cran.wu-wien.ac.at.www: . ack 95569 win 63712 <nop,nop,timestamp 821421206 92827738>
12:58:37.633571 IP oberplag.ser.de.44909 > cran.wu-wien.ac.at.www: . ack 98465 win 63712 <nop,nop,timestamp 821421206 92827738>
12:58:37.634258 IP oberplag.ser.de.44909 > cran.wu-wien.ac.at.www: . ack 101361 win 63712 <nop,nop,timestamp 821421206 92827739>
12:58:37.634805 IP oberplag.ser.de.44909 > cran.wu-wien.ac.at.www: . ack 104257 win 63712 <nop,nop,timestamp 821421206 92827739>
12:58:37.637366 IP ds11.internetdsl.tpnet.pl.40263 > cran.wu-wien.ac.at.www: . ack 13285 win 2172 <nop,nop,timestamp 219051464 92827733>
12:58:37.637379 IP cran.wu-wien.ac.at.www > ds11.internetdsl.tpnet.pl.40263: . 17329:17377(48) ack 0 win 1716 <nop,nop,timestamp 92827741 219051464>
12:58:37.639804 IP ds11.internetdsl.tpnet.pl.40263 > cran.wu-wien.ac.at.www: . ack 14733 win 2896 <nop,nop,timestamp 219051467 92827733>
12:58:37.639822 IP cran.wu-wien.ac.at.www > ds11.internetdsl.tpnet.pl.40263: . 21973:24869(2896) ack 0 win 1716 <nop,nop,timestamp 92827741 219051467>
12:58:37.639833 IP cran.wu-wien.ac.at.www > ds11.internetdsl.tpnet.pl.40263: . 24869:26065(1196) ack 0 win 1716 <nop,nop,timestamp 92827741 219051467>
12:58:37.698229 IP cran.wu-wien.ac.at.www > ds11.internetdsl.tpnet.pl.40263: . 34705:34753(48) ack 0 win 1716 <nop,nop,timestamp 92827747 219051561>
12:58:38.338638 IP oberplag.ser.de.44909 > cran.wu-wien.ac.at.www: . ack 405441 win 63712 <nop,nop,timestamp 821421277 92827804,nop,nop,sack sack 1 {406889:418473} >
12:58:38.338656 IP cran.wu-wien.ac.at.www > oberplag.ser.de.44909: . 421369:422817(1448) ack 0 win 1716 <nop,nop,timestamp 92827811 821421277>
12:58:38.339297 IP oberplag.ser.de.44909 > cran.wu-wien.ac.at.www: . ack 405441 win 63712 <nop,nop,timestamp 821421277 92827804,nop,nop,sack sack 1 {406889:419921} >
12:58:38.339307 IP oberplag.ser.de.44909 > cran.wu-wien.ac.at.www: . ack 419921 win 52128 <nop,nop,timestamp 821421277 92827809>
12:58:38.339325 IP cran.wu-wien.ac.at.www > oberplag.ser.de.44909: . 422817:424265(1448) ack 0 win 1716 <nop,nop,timestamp 92827811 821421277>
12:58:38.349825 IP cran.wu-wien.ac.at.32879 > ns3.wu-wien.ac.at.domain:  12195+ PTR? 129.252.246.202.in-addr.arpa. (46)
12:58:38.350325 IP ns3.wu-wien.ac.at.domain > cran.wu-wien.ac.at.32879:  12195 1/4/4 (213)
12:58:38.350502 IP cran.wu-wien.ac.at.32879 > ns3.wu-wien.ac.at.domain:  12196+ PTR? 8.24.124.222.in-addr.arpa. (43)
12:58:38.358278 IP oberplag.ser.de.44909 > cran.wu-wien.ac.at.www: . ack 421369 win 63712 <nop,nop,timestamp 821421279 92827811>
12:58:38.358299 IP cran.wu-wien.ac.at.www > oberplag.ser.de.44909: . 424265:427161(2896) ack 0 win 1716 <nop,nop,timestamp 92827813 821421279>
12:58:38.358953 IP oberplag.ser.de.44909 > cran.wu-wien.ac.at.www: . ack 422817 win 63712 <nop,nop,timestamp 821421279 92827811>
12:58:38.358969 IP cran.wu-wien.ac.at.www > oberplag.ser.de.44909: . 427161:428609(1448) ack 0 win 1716 <nop,nop,timestamp 92827813 821421279>
12:58:38.359985 IP oberplag.ser.de.44909 > cran.wu-wien.ac.at.www: . ack 424265 win 63712 <nop,nop,timestamp 821421279 92827811>
12:58:38.378908 IP oberplag.ser.de.44909 > cran.wu-wien.ac.at.www: . ack 425713 win 63712 <nop,nop,timestamp 821421281 92827813>
12:58:38.378925 IP cran.wu-wien.ac.at.www > oberplag.ser.de.44909: . 428609:431505(2896) ack 0 win 1716 <nop,nop,timestamp 92827815 821421281>
12:58:38.378932 IP oberplag.ser.de.44909 > cran.wu-wien.ac.at.www: . ack 427161 win 63712 <nop,nop,timestamp 821421281 92827813>
12:58:38.379543 IP oberplag.ser.de.44909 > cran.wu-wien.ac.at.www: . ack 428609 win 63712 <nop,nop,timestamp 821421281 92827813>
12:58:38.379559 IP cran.wu-wien.ac.at.www > oberplag.ser.de.44909: . 431505:435849(4344) ack 0 win 1716 <nop,nop,timestamp 92827815 821421281>
12:58:38.388160 IP 246.062.dsl.syd.iprimus.net.au.49432 > cran.wu-wien.ac.at.www: . ack 25705 win 65535 <nop,nop,timestamp 2039312107 92827692>
12:58:38.388189 IP cran.wu-wien.ac.at.www > 246.062.dsl.syd.iprimus.net.au.49432: P 49981:64261(14280) ack 0 win 1716 <nop,nop,timestamp 92827816 2039312107>
12:58:38.400277 IP oberplag.ser.de.44909 > cran.wu-wien.ac.at.www: . ack 430057 win 63712 <nop,nop,timestamp 821421283 92827815>
12:58:38.400979 IP oberplag.ser.de.44909 > cran.wu-wien.ac.at.www: . ack 431505 win 63712 <nop,nop,timestamp 821421283 92827815>
12:58:38.400995 IP cran.wu-wien.ac.at.www > oberplag.ser.de.44909: . 435849:438745(2896) ack 0 win 1716 <nop,nop,timestamp 92827817 821421283>
12:58:38.401002 IP oberplag.ser.de.44909 > cran.wu-wien.ac.at.www: . ack 432953 win 63712 <nop,nop,timestamp 821421283 92827815>
12:58:38.401011 IP oberplag.ser.de.44909 > cran.wu-wien.ac.at.www: . ack 434401 win 63712 <nop,nop,timestamp 821421283 92827815>
12:58:38.401026 IP cran.wu-wien.ac.at.www > oberplag.ser.de.44909: . 438745:441641(2896) ack 0 win 1716 <nop,nop,timestamp 92827817 821421283>
12:58:38.401679 IP oberplag.ser.de.44909 > cran.wu-wien.ac.at.www: . ack 435849 win 63712 <nop,nop,timestamp 821421283 92827815>
12:58:38.406748 IP CPE-60-226-194-57.sa.bigpond.net.au.51687 > cran.wu-wien.ac.at.www: . ack 4029756725 win 44888 <nop,nop,timestamp 450906901 92827782>
12:58:38.406767 IP cran.wu-wien.ac.at.www > CPE-60-226-194-57.sa.bigpond.net.au.51687: . 7241:11585(4344) ack 0 win 1716 <nop,nop,timestamp 92827818 450906901>
12:58:38.410649 IP CPE-60-226-194-57.sa.bigpond.net.au.51687 > cran.wu-wien.ac.at.www: . ack 2897 win 44888 <nop,nop,timestamp 450906901 92827782>
12:58:38.414592 IP CPE-60-226-194-57.sa.bigpond.net.au.51687 > cran.wu-wien.ac.at.www: . ack 2897 win 44888 <nop,nop,timestamp 450906901 92827782>
12:58:38.414609 IP cran.wu-wien.ac.at.www > CPE-60-226-194-57.sa.bigpond.net.au.51687: . 11585:15929(4344) ack 0 win 1716 <nop,nop,timestamp 92827819 450906901>
12:58:38.417968 IP 203-217-55-233.dyn.iinet.net.au.23649 > cran.wu-wien.ac.at.www: . ack 1969880861 win 65535
12:58:38.417986 IP cran.wu-wien.ac.at.www > 203-217-55-233.dyn.iinet.net.au.23649: . 1453:5809(4356) ack 0 win 6432
12:58:38.418666 IP CPE-60-226-194-57.sa.bigpond.net.au.51687 > cran.wu-wien.ac.at.www: . ack 5793 win 44888 <nop,nop,timestamp 450906901 92827782>
12:58:38.421711 IP oberplag.ser.de.44909 > cran.wu-wien.ac.at.www: . ack 437297 win 63712 <nop,nop,timestamp 821421285 92827817>
12:58:38.421730 IP cran.wu-wien.ac.at.www > oberplag.ser.de.44909: . 441641:445985(4344) ack 0 win 1716 <nop,nop,timestamp 92827819 821421285>
12:58:38.421737 IP oberplag.ser.de.44909 > cran.wu-wien.ac.at.www: . ack 438745 win 63712 <nop,nop,timestamp 821421285 92827817>
12:58:38.422222 IP oberplag.ser.de.44909 > cran.wu-wien.ac.at.www: . ack 440193 win 63712 <nop,nop,timestamp 821421285 92827817>
12:58:38.422237 IP cran.wu-wien.ac.at.www > oberplag.ser.de.44909: . 445985:448881(2896) ack 0 win 1716 <nop,nop,timestamp 92827820 821421285>
12:58:38.428603 IP CPE-60-226-194-57.sa.bigpond.net.au.51687 > cran.wu-wien.ac.at.www: . ack 7241 win 44888 <nop,nop,timestamp 450906901 92827783>
12:58:38.442623 IP oberplag.ser.de.44909 > cran.wu-wien.ac.at.www: . ack 443089 win 63712 <nop,nop,timestamp 821421287 92827817>
12:58:38.442640 IP cran.wu-wien.ac.at.www > oberplag.ser.de.44909: . 448881:451777(2896) ack 0 win 1716 <nop,nop,timestamp 92827822 821421287>
12:58:38.443255 IP oberplag.ser.de.44909 > cran.wu-wien.ac.at.www: . ack 445985 win 63712 <nop,nop,timestamp 821421287 92827819>
12:58:38.444008 IP oberplag.ser.de.44909 > cran.wu-wien.ac.at.www: . ack 448881 win 63712 <nop,nop,timestamp 821421287 92827820>
12:58:38.463713 IP oberplag.ser.de.44909 > cran.wu-wien.ac.at.www: . ack 451777 win 63712 <nop,nop,timestamp 821421289 92827822>
12:58:38.464273 IP oberplag.ser.de.44909 > cran.wu-wien.ac.at.www: . ack 454673 win 63712 <nop,nop,timestamp 821421289 92827822>
12:58:39.718313 IP cran.wu-wien.ac.at.32879 > ns3.wu-wien.ac.at.domain:  12197+ PTR? 57.194.226.60.in-addr.arpa. (44)
12:58:39.719542 IP ds11.internetdsl.tpnet.pl.36782 > cran.wu-wien.ac.at.www: . ack 3162620532 win 2896 <nop,nop,timestamp 219053583 92827938>
12:58:39.719563 IP cran.wu-wien.ac.at.www > ds11.internetdsl.tpnet.pl.36782: . 4345:7241(2896) ack 0 win 1716 <nop,nop,timestamp 92827949 219053583>
12:58:39.722108 IP ds11.internetdsl.tpnet.pl.36782 > cran.wu-wien.ac.at.www: . ack 1449 win 3620 <nop,nop,timestamp 219053585 92827938>
12:58:39.722125 IP cran.wu-wien.ac.at.www > ds11.internetdsl.tpnet.pl.36782: . 7241:10137(2896) ack 0 win 1716 <nop,nop,timestamp 92827949 219053585>
12:58:39.725429 IP ds11.internetdsl.tpnet.pl.36782 > cran.wu-wien.ac.at.www: . ack 2897 win 4344 <nop,nop,timestamp 219053588 92827939>
12:58:39.728943 IP ds11.internetdsl.tpnet.pl.36782 > cran.wu-wien.ac.at.www: . ack 4345 win 5068 <nop,nop,timestamp 219053591 92827939>
12:58:39.728962 IP cran.wu-wien.ac.at.www > ds11.internetdsl.tpnet.pl.36782: . 10137:14481(4344) ack 0 win 1716 <nop,nop,timestamp 92827950 219053591>
12:58:39.731287 IP 193.134.202.252.59285 > cran.wu-wien.ac.at.www: . ack 4121626635 win 49680
12:58:39.734696 IP oberplag.ser.de.44909 > cran.wu-wien.ac.at.www: . ack 839841 win 63712 <nop,nop,timestamp 821421416 92827926,nop,nop,sack sack 1 {841289:880385} >
12:58:39.734714 IP cran.wu-wien.ac.at.www > oberplag.ser.de.44909: . 881833:883281(1448) ack 0 win 1716 <nop,nop,timestamp 92827951 821421416>
12:58:39.734953 IP 193.134.202.252.59285 > cran.wu-wien.ac.at.www: P 0:77(77) ack 1 win 49680
12:58:39.734967 IP cran.wu-wien.ac.at.www > 193.134.202.252.59285: . ack 77 win 5840
12:58:39.735042 IP cran.wu-wien.ac.at.www > 193.134.202.252.59285: P 1:529(528) ack 77 win 5840
12:58:39.735065 IP cran.wu-wien.ac.at.www > 193.134.202.252.59285: F 529:529(0) ack 77 win 5840
12:58:39.737081 IP oberplag.ser.de.44909 > cran.wu-wien.ac.at.www: . ack 839841 win 63712 <nop,nop,timestamp 821421416 92827926,nop,nop,sack sack 1 {841289:881833} >
12:58:39.737098 IP cran.wu-wien.ac.at.www > oberplag.ser.de.44909: . 883281:884729(1448) ack 0 win 1716 <nop,nop,timestamp 92827951 821421416>
12:58:39.748892 IP cran.wu-wien.ac.at.www > oberplag.ser.de.44909: . 839841:841289(1448) ack 0 win 1716 <nop,nop,timestamp 92827952 821421416>
12:58:39.755638 IP oberplag.ser.de.44909 > cran.wu-wien.ac.at.www: . ack 839841 win 63712 <nop,nop,timestamp 821421418 92827926,nop,nop,sack sack 1 {841289:883281} >
12:58:39.757460 IP oberplag.ser.de.44909 > cran.wu-wien.ac.at.www: . ack 839841 win 63712 <nop,nop,timestamp 821421419 92827926,nop,nop,sack sack 1 {841289:884729} >
12:58:39.769028 IP oberplag.ser.de.44909 > cran.wu-wien.ac.at.www: . ack 884729 win 26064 <nop,nop,timestamp 821421420 92827952>
12:58:39.769056 IP cran.wu-wien.ac.at.www > oberplag.ser.de.44909: . 884729:886177(1448) ack 0 win 1716 <nop,nop,timestamp 92827954 821421420>
12:58:39.769738 IP oberplag.ser.de.44909 > cran.wu-wien.ac.at.www: . ack 884729 win 53576 <nop,nop,timestamp 821421420 92827952>
12:58:39.792580 IP 246.062.dsl.syd.iprimus.net.au.49432 > cran.wu-wien.ac.at.www: . ack 62833 win 65535 <nop,nop,timestamp 2039312110 92827816>
12:58:39.815362 IP ds11.internetdsl.tpnet.pl.36782 > cran.wu-wien.ac.at.www: . ack 5793 win 5792 <nop,nop,timestamp 219053679 92827949>
12:58:39.818642 IP ds11.internetdsl.tpnet.pl.36782 > cran.wu-wien.ac.at.www: . ack 7241 win 6516 <nop,nop,timestamp 219053681 92827949>
12:58:39.818652 IP 203-217-55-233.dyn.iinet.net.au.23649 > cran.wu-wien.ac.at.www: . ack 8713 win 65535 <nop,nop,sack sack 2 {10165:13069}{14521:15973} >
12:58:39.818668 IP cran.wu-wien.ac.at.www > 203-217-55-233.dyn.iinet.net.au.23649: . 8713:10165(1452) ack 0 win 6432
12:58:39.818675 IP 193.204.15.29.49311 > cran.wu-wien.ac.at.www: . ack 9577 win 62928 <nop,nop,timestamp 956225741 92827913>
12:58:39.818694 IP cran.wu-wien.ac.at.www > 193.204.15.29.49311: . 9577:13681(4104) ack 0 win 1716 <nop,nop,timestamp 92827959 956225741>
12:58:39.821137 IP 203-217-55-233.dyn.iinet.net.au.23649 > cran.wu-wien.ac.at.www: . ack 8713 win 65535 <nop,nop,sack sack 2 {14521:17425}{10165:13069} >
12:58:39.821548 IP ds11.internetdsl.tpnet.pl.36782 > cran.wu-wien.ac.at.www: . ack 8689 win 7240 <nop,nop,timestamp 219053684 92827949>
12:58:39.821568 IP cran.wu-wien.ac.at.www > ds11.internetdsl.tpnet.pl.36782: . 14481:20273(5792) ack 0 win 1716 <nop,nop,timestamp 92827959 219053684>
12:58:39.824005 IP ds11.internetdsl.tpnet.pl.36782 > cran.wu-wien.ac.at.www: . ack 10137 win 7964 <nop,nop,timestamp 219053687 92827949>
12:58:39.826245 IP 193.134.202.252.59285 > cran.wu-wien.ac.at.www: . ack 1 win 49680
12:58:39.827204 IP oberplag.ser.de.44909 > cran.wu-wien.ac.at.www: . ack 886177 win 63712 <nop,nop,timestamp 821421426 92827954>
12:58:39.827221 IP cran.wu-wien.ac.at.www > oberplag.ser.de.44909: . 886177:889073(2896) ack 0 win 1716 <nop,nop,timestamp 92827960 821421426>
12:58:39.827418 IP 193.134.202.252.59285 > cran.wu-wien.ac.at.www: . ack 530 win 49680
12:58:39.828385 IP 193.134.202.252.59285 > cran.wu-wien.ac.at.www: F 77:77(0) ack 530 win 49680
12:58:39.828397 IP cran.wu-wien.ac.at.www > 193.134.202.252.59285: . ack 78 win 5840
12:58:39.828891 IP cran.wu-wien.ac.at.rsync > info.ugm.ac.id.50793: . 1449:2897(1448) ack 0 win 0 <nop,nop,timestamp 92827960 2516967777>
12:58:39.829227 IP ds11.internetdsl.tpnet.pl.36782 > cran.wu-wien.ac.at.www: . ack 11585 win 8065 <nop,nop,timestamp 219053690 92827950>
12:58:39.835555 IP px4.hitachi.co.jp.14462 > cran.wu-wien.ac.at.www: P 528:1057(529) ack 576 win 7029
12:58:39.835639 IP cran.wu-wien.ac.at.www > px4.hitachi.co.jp.14462: P 576:1153(577) ack 1057 win 16080
12:58:39.847749 IP oberplag.ser.de.44909 > cran.wu-wien.ac.at.www: . ack 889073 win 63712 <nop,nop,timestamp 821421428 92827960>
12:58:39.847769 IP cran.wu-wien.ac.at.www > oberplag.ser.de.44909: . 889073:893417(4344) ack 0 win 1716 <nop,nop,timestamp 92827962 821421428>
12:58:39.869541 IP oberplag.ser.de.44909 > cran.wu-wien.ac.at.www: . ack 891969 win 63712 <nop,nop,timestamp 821421430 92827962>
12:58:39.869559 IP cran.wu-wien.ac.at.www > oberplag.ser.de.44909: . 893417:897761(4344) ack 0 win 1716 <nop,nop,timestamp 92827964 821421430>
12:58:39.870575 IP CPE-60-226-194-57.sa.bigpond.net.au.51687 > cran.wu-wien.ac.at.www: . ack 47785 win 44888 <nop,nop,timestamp 450906904 92827928>
12:58:39.872172 IP 246.062.dsl.syd.iprimus.net.au.49432 > cran.wu-wien.ac.at.www: . ack 64261 win 65535 <nop,nop,timestamp 2039312110 92827816>
12:58:39.876442 IP CPE-60-226-194-57.sa.bigpond.net.au.51687 > cran.wu-wien.ac.at.www: . ack 53577 win 44888 <nop,nop,timestamp 450906904 92827928>
12:58:39.876465 IP cran.wu-wien.ac.at.www > CPE-60-226-194-57.sa.bigpond.net.au.51687: . 57921:68057(10136) ack 0 win 1716 <nop,nop,timestamp 92827965 450906904>
12:58:39.880360 IP CPE-60-226-194-57.sa.bigpond.net.au.51687 > cran.wu-wien.ac.at.www: . ack 56473 win 44888 <nop,nop,timestamp 450906904 92827929>
12:58:39.884808 IP CPE-60-226-194-57.sa.bigpond.net.au.51687 > cran.wu-wien.ac.at.www: . ack 56473 win 44888 <nop,nop,timestamp 450906904 92827929>
12:58:39.884826 IP cran.wu-wien.ac.at.www > CPE-60-226-194-57.sa.bigpond.net.au.51687: . 68057:72401(4344) ack 0 win 1716 <nop,nop,timestamp 92827966 450906904>
12:58:39.890030 IP oberplag.ser.de.44909 > cran.wu-wien.ac.at.www: . ack 894865 win 63712 <nop,nop,timestamp 821421432 92827962>
12:58:39.890047 IP cran.wu-wien.ac.at.www > oberplag.ser.de.44909: . 897761:900657(2896) ack 0 win 1716 <nop,nop,timestamp 92827966 821421432>
12:58:39.890476 IP oberplag.ser.de.44909 > cran.wu-wien.ac.at.www: . ack 897761 win 63712 <nop,nop,timestamp 821421432 92827964>
12:58:39.890489 IP cran.wu-wien.ac.at.www > oberplag.ser.de.44909: P 900657:902105(1448) ack 0 win 1716 <nop,nop,timestamp 92827966 821421432>
12:58:39.905979 IP ds11.internetdsl.tpnet.pl.36782 > cran.wu-wien.ac.at.www: . ack 14481 win 7341 <nop,nop,timestamp 219053733 92827950>
12:58:39.905996 IP cran.wu-wien.ac.at.www > ds11.internetdsl.tpnet.pl.36782: . 20273:23169(2896) ack 0 win 1716 <nop,nop,timestamp 92827968 219053733>
12:58:39.911389 IP oberplag.ser.de.44909 > cran.wu-wien.ac.at.www: . ack 900657 win 63712 <nop,nop,timestamp 821421434 92827966>
12:58:39.931985 IP oberplag.ser.de.44909 > cran.wu-wien.ac.at.www: . ack 903553 win 63712 <nop,nop,timestamp 821421436 92827966>
12:58:39.932690 IP oberplag.ser.de.44909 > cran.wu-wien.ac.at.www: . ack 906449 win 63712 <nop,nop,timestamp 821421436 92827968>
12:58:40.442024 IP cran.wu-wien.ac.at.32879 > ns3.wu-wien.ac.at.domain:  12198+ PTR? 233.55.217.203.in-addr.arpa. (45)
12:58:40.454237 IP oxfd-cache-2.server.ntli.net.23126 > cran.wu-wien.ac.at.www: . ack 4136126208 win 63678 <nop,nop,timestamp 3083507939 92828019>
12:58:40.454601 IP oberplag.ser.de.44909 > cran.wu-wien.ac.at.www: . ack 968713 win 63712 <nop,nop,timestamp 821421488 92828021>
12:58:40.455173 IP oberplag.ser.de.44909 > cran.wu-wien.ac.at.www: . ack 970161 win 63712 <nop,nop,timestamp 821421488 92828021>
12:58:40.455190 IP cran.wu-wien.ac.at.www > oberplag.ser.de.44909: . 973057:975953(2896) ack 0 win 1716 <nop,nop,timestamp 92828023 821421488>
12:58:40.455197 IP oberplag.ser.de.44909 > cran.wu-wien.ac.at.www: . ack 971609 win 63712 <nop,nop,timestamp 821421488 92828021>
12:58:40.455795 IP oberplag.ser.de.44909 > cran.wu-wien.ac.at.www: . ack 973057 win 63712 <nop,nop,timestamp 821421488 92828021>
12:58:40.455809 IP cran.wu-wien.ac.at.www > oberplag.ser.de.44909: . 975953:978849(2896) ack 0 win 1716 <nop,nop,timestamp 92828023 821421488>
12:58:40.468077 IP 246.062.dsl.syd.iprimus.net.au.49432 > cran.wu-wien.ac.at.www: . ack 79969 win 65535 <nop,nop,timestamp 2039312111 92827875>
12:58:40.475770 IP oberplag.ser.de.44909 > cran.wu-wien.ac.at.www: . ack 974505 win 63712 <nop,nop,timestamp 821421490 92828023>
12:58:40.476083 IP oberplag.ser.de.44909 > cran.wu-wien.ac.at.www: . ack 975953 win 63712 <nop,nop,timestamp 821421490 92828023>
12:58:40.476234 IP oberplag.ser.de.44909 > cran.wu-wien.ac.at.www: . ack 977401 win 63712 <nop,nop,timestamp 821421490 92828023>
12:58:40.476624 IP oberplag.ser.de.44909 > cran.wu-wien.ac.at.www: . ack 978849 win 63712 <nop,nop,timestamp 821421490 92828023>
12:58:40.496282 IP oberplag.ser.de.44909 > cran.wu-wien.ac.at.www: . ack 980297 win 63712 <nop,nop,timestamp 821421492 92828025>
12:58:40.498055 IP oberplag.ser.de.44909 > cran.wu-wien.ac.at.www: . ack 983193 win 63712 <nop,nop,timestamp 821421492 92828025>
12:58:40.846355 IP cran.wu-wien.ac.at.32879 > ns3.wu-wien.ac.at.domain:  12199+ PTR? 252.202.134.193.in-addr.arpa. (46)
12:58:40.854877 IP oberplag.ser.de.44909 > cran.wu-wien.ac.at.www: . ack 1125097 win 63712 <nop,nop,timestamp 821421528 92828057,nop,nop,sack sack 1 {1126545:1136681} >
12:58:40.854898 IP cran.wu-wien.ac.at.www > oberplag.ser.de.44909: . 1139577:1141025(1448) ack 0 win 1716 <nop,nop,timestamp 92828063 821421528>
12:58:40.856866 IP oberplag.ser.de.44909 > cran.wu-wien.ac.at.www: . ack 1125097 win 63712 <nop,nop,timestamp 821421528 92828057,nop,nop,sack sack 1 {1126545:1138129} >
12:58:40.856876 IP oberplag.ser.de.44909 > cran.wu-wien.ac.at.www: . ack 1138129 win 53576 <nop,nop,timestamp 821421528 92828061>
12:58:40.856894 IP cran.wu-wien.ac.at.www > oberplag.ser.de.44909: . 1141025:1142473(1448) ack 0 win 1716 <nop,nop,timestamp 92828063 821421528>
12:58:40.857478 IP oberplag.ser.de.44909 > cran.wu-wien.ac.at.www: . ack 1139577 win 63712 <nop,nop,timestamp 821421529 92828061>
12:58:40.857496 IP cran.wu-wien.ac.at.www > oberplag.ser.de.44909: . 1142473:1145369(2896) ack 0 win 1716 <nop,nop,timestamp 92828063 821421529>
12:58:40.858096 IP 213-125-192-229.edu.multikabel.nl.25097 > cran.wu-wien.ac.at.www: . ack 4137114605 win 65535
12:58:40.861873 IP 213-125-192-229.edu.multikabel.nl.25097 > cran.wu-wien.ac.at.www: P 0:260(260) ack 1 win 65535
12:58:40.861891 IP cran.wu-wien.ac.at.www > 213-125-192-229.edu.multikabel.nl.25097: . ack 260 win 6432
12:58:40.862070 IP cran.wu-wien.ac.at.www > 213-125-192-229.edu.multikabel.nl.25097: P 1:956(955) ack 260 win 6432
12:58:40.869675 IP lj2245.inktomisearch.com.40094 > cran.wu-wien.ac.at.www: S 2258572354:2258572354(0) win 5840 <mss 1460,sackOK,timestamp 2631572462 0,nop,wscale 0>
12:58:40.869711 IP cran.wu-wien.ac.at.www > lj2245.inktomisearch.com.40094: S 4131621222:4131621222(0) ack 2258572355 win 5792 <mss 1460,sackOK,timestamp 92828064 2631572462,nop,wscale 2>
12:58:40.872169 IP 246.062.dsl.syd.iprimus.net.au.49432 > cran.wu-wien.ac.at.www: . ack 91393 win 65535 <nop,nop,timestamp 2039312112 92827940>
12:58:40.876000 IP oberplag.ser.de.44909 > cran.wu-wien.ac.at.www: . ack 1141025 win 63712 <nop,nop,timestamp 821421530 92828063>
12:58:40.876017 IP cran.wu-wien.ac.at.www > oberplag.ser.de.44909: . 1145369:1146817(1448) ack 0 win 1716 <nop,nop,timestamp 92828065 821421530>
12:58:40.876423 IP cache15-4.ruh.isu.net.sa.27759 > cran.wu-wien.ac.at.www: . ack 3305824318 win 0
12:58:40.877366 IP oberplag.ser.de.44909 > cran.wu-wien.ac.at.www: . ack 1142473 win 63712 <nop,nop,timestamp 821421530 92828063>
12:58:40.878044 IP oberplag.ser.de.44909 > cran.wu-wien.ac.at.www: . ack 1143921 win 63712 <nop,nop,timestamp 821421531 92828063>
12:58:40.878059 IP cran.wu-wien.ac.at.www > oberplag.ser.de.44909: . 1146817:1149713(2896) ack 0 win 1716 <nop,nop,timestamp 92828065 821421531>
12:58:40.878066 IP oberplag.ser.de.44909 > cran.wu-wien.ac.at.www: . ack 1145369 win 63712 <nop,nop,timestamp 821421531 92828063>
12:58:40.889054 IP cran.wu-wien.ac.at.www > 85.249.192.107.1239: F 4111547660:4111547660(0) ack 1121307432 win 11792
12:58:40.896314 IP oberplag.ser.de.44909 > cran.wu-wien.ac.at.www: . ack 1146817 win 63712 <nop,nop,timestamp 821421532 92828065>
12:58:40.896334 IP cran.wu-wien.ac.at.www > oberplag.ser.de.44909: . 1149713:1154057(4344) ack 0 win 1716 <nop,nop,timestamp 92828067 821421532>
12:58:40.898689 IP oberplag.ser.de.44909 > cran.wu-wien.ac.at.www: . ack 1148265 win 63712 <nop,nop,timestamp 821421533 92828065>
12:58:40.899253 IP oberplag.ser.de.44909 > cran.wu-wien.ac.at.www: . ack 1149713 win 63712 <nop,nop,timestamp 821421533 92828065>
12:58:40.899269 IP cran.wu-wien.ac.at.www > oberplag.ser.de.44909: P 1154057:1156953(2896) ack 0 win 1716 <nop,nop,timestamp 92828067 821421533>
12:58:40.912665 IP 193.134.202.252.59287 > cran.wu-wien.ac.at.www: S 2569240676:2569240676(0) win 49640 <mss 1380,nop,nop,sackOK>
12:58:40.912689 IP cran.wu-wien.ac.at.www > 193.134.202.252.59287: S 4129094655:4129094655(0) ack 2569240677 win 5840 <mss 1460,nop,nop,sackOK>
12:58:40.916640 IP oberplag.ser.de.44909 > cran.wu-wien.ac.at.www: . ack 1151161 win 63712 <nop,nop,timestamp 821421534 92828067>
12:58:40.917282 IP oberplag.ser.de.44909 > cran.wu-wien.ac.at.www: . ack 1152609 win 63712 <nop,nop,timestamp 821421534 92828067>
12:58:40.917739 IP oberplag.ser.de.44909 > cran.wu-wien.ac.at.www: . ack 1154057 win 63712 <nop,nop,timestamp 821421535 92828067>
12:58:40.919622 IP oberplag.ser.de.44909 > cran.wu-wien.ac.at.www: . ack 1155505 win 63712 <nop,nop,timestamp 821421535 92828067>
12:58:40.920229 IP oberplag.ser.de.44909 > cran.wu-wien.ac.at.www: . ack 1156953 win 63712 <nop,nop,timestamp 821421535 92828067>
12:58:40.937945 IP oberplag.ser.de.44909 > cran.wu-wien.ac.at.www: . ack 1158401 win 63712 <nop,nop,timestamp 821421537 92828069>
12:58:40.939894 IP oberplag.ser.de.44909 > cran.wu-wien.ac.at.www: . ack 1161297 win 63712 <nop,nop,timestamp 821421537 92828069>
12:58:40.940447 IP oberplag.ser.de.44909 > cran.wu-wien.ac.at.www: . ack 1164193 win 63712 <nop,nop,timestamp 821421537 92828069>
12:58:41.176612 IP cacheng.unige.ch.53443 > cran.wu-wien.ac.at.www: P 270833766:270834109(343) ack 4136857307 win 65535
12:58:41.176827 IP cran.wu-wien.ac.at.www > cacheng.unige.ch.53443: P 1:651(650) ack 343 win 7504
12:58:41.176929 IP cran.wu-wien.ac.at.32879 > ns3.wu-wien.ac.at.domain:  12200+ PTR? 5.128.254.62.in-addr.arpa. (43)
12:58:41.188322 IP oberplag.ser.de.44909 > cran.wu-wien.ac.at.www: . ack 1243833 win 63712 <nop,nop,timestamp 821421562 92828094>
12:58:41.188341 IP cran.wu-wien.ac.at.www > oberplag.ser.de.44909: . 1251073:1252521(1448) ack 0 win 1716 <nop,nop,timestamp 92828096 821421562>
12:58:41.188774 IP 213-125-192-229.edu.multikabel.nl.25097 > cran.wu-wien.ac.at.www: P 260:524(264) ack 956 win 65535
12:58:41.188939 IP cran.wu-wien.ac.at.www > 213-125-192-229.edu.multikabel.nl.25097: P 956:1514(558) ack 524 win 7504
12:58:41.190496 IP 246.062.dsl.syd.iprimus.net.au.49432 > cran.wu-wien.ac.at.www: . ack 99961 win 65180 <nop,nop,timestamp 2039312113 92827984>
12:58:41.190517 IP cran.wu-wien.ac.at.www > 246.062.dsl.syd.iprimus.net.au.49432: P 124237:127093(2856) ack 0 win 1716 <nop,nop,timestamp 92828096 2039312113>
12:58:41.190673 IP oberplag.ser.de.44909 > cran.wu-wien.ac.at.www: . ack 1246729 win 63712 <nop,nop,timestamp 821421562 92828094>
12:58:41.190691 IP cran.wu-wien.ac.at.www > oberplag.ser.de.44909: . 1252521:1256865(4344) ack 0 win 1716 <nop,nop,timestamp 92828096 821421562>
12:58:41.191113 IP oberplag.ser.de.44909 > cran.wu-wien.ac.at.www: . ack 1249625 win 63712 <nop,nop,timestamp 821421562 92828094>
12:58:41.191447 IP 213-125-192-229.edu.multikabel.nl.25086 > cran.wu-wien.ac.at.www: P 949969815:949970081(266) ack 4130224168 win 65535
12:58:41.191598 IP cran.wu-wien.ac.at.www > 213-125-192-229.edu.multikabel.nl.25086: . 1:1461(1460) ack 266 win 7504
12:58:41.191614 IP cran.wu-wien.ac.at.www > 213-125-192-229.edu.multikabel.nl.25086: P 1461:2012(551) ack 266 win 7504
12:58:41.203645 IP cacheng.unige.ch.53452 > cran.wu-wien.ac.at.www: S 3863351919:3863351919(0) win 65535 <mss 1432>
12:58:41.203670 IP cran.wu-wien.ac.at.www > cacheng.unige.ch.53452: S 4129188812:4129188812(0) ack 3863351920 win 5840 <mss 1460>
12:58:41.203939 IP cacheng.unige.ch.53443 > cran.wu-wien.ac.at.www: P 343:803(460) ack 651 win 65535
12:58:41.204104 IP cran.wu-wien.ac.at.www > cacheng.unige.ch.53443: P 651:2058(1407) ack 803 win 8576
12:58:41.208958 IP oberplag.ser.de.44909 > cran.wu-wien.ac.at.www: . ack 1252521 win 63712 <nop,nop,timestamp 821421564 92828094>
12:58:41.208981 IP cran.wu-wien.ac.at.www > oberplag.ser.de.44909: . 1256865:1262657(5792) ack 0 win 1716 <nop,nop,timestamp 92828098 821421564>
12:58:41.211758 IP oberplag.ser.de.44909 > cran.wu-wien.ac.at.www: . ack 1255417 win 63712 <nop,nop,timestamp 821421564 92828096>
12:58:41.219322 IP lj2245.inktomisearch.com.40094 > cran.wu-wien.ac.at.www: . ack 422 win 6432 <nop,nop,timestamp 2631572497 92828082>
12:58:41.220116 IP lj2245.inktomisearch.com.40094 > cran.wu-wien.ac.at.www: F 218:218(0) ack 423 win 6432 <nop,nop,timestamp 2631572497 92828082>
12:58:41.220131 IP cran.wu-wien.ac.at.www > lj2245.inktomisearch.com.40094: . ack 219 win 1716 <nop,nop,timestamp 92828099 2631572497>
12:58:41.226026 IP cacheng.unige.ch.53452 > cran.wu-wien.ac.at.www: P 1:459(458) ack 1 win 65535
12:58:41.226045 IP cran.wu-wien.ac.at.www > cacheng.unige.ch.53452: . ack 459 win 6432
12:58:41.226245 IP cran.wu-wien.ac.at.www > cacheng.unige.ch.53452: P 1:542(541) ack 459 win 6432
12:58:41.229624 IP cacheng.unige.ch.53443 > cran.wu-wien.ac.at.www: P 803:1264(461) ack 2058 win 65535
12:58:41.229642 IP oberplag.ser.de.44909 > cran.wu-wien.ac.at.www: . ack 1258313 win 63712 <nop,nop,timestamp 821421566 92828096>
12:58:41.229665 IP cran.wu-wien.ac.at.www > oberplag.ser.de.44909: . 1262657:1269897(7240) ack 0 win 1716 <nop,nop,timestamp 92828100 821421566>
12:58:41.229856 IP cran.wu-wien.ac.at.www > cacheng.unige.ch.53443: . 2058:4922(2864) ack 1264 win 9648
12:58:41.230254 IP oberplag.ser.de.44909 > cran.wu-wien.ac.at.www: . ack 1261209 win 63712 <nop,nop,timestamp 821421566 92828098>
12:58:41.247458 IP ns3.wu-wien.ac.at.domain > cran.wu-wien.ac.at.32879:  12200 1/2/2 (155)
12:58:41.247707 IP cacheng.unige.ch.53452 > cran.wu-wien.ac.at.www: . ack 542 win 64995
12:58:41.247748 IP cran.wu-wien.ac.at.32879 > ns3.wu-wien.ac.at.domain:  12201+ PTR? 229.192.125.213.in-addr.arpa. (46)
12:58:41.250011 IP oberplag.ser.de.44909 > cran.wu-wien.ac.at.www: . ack 1264105 win 63712 <nop,nop,timestamp 821421568 92828098>
12:58:41.250033 IP cran.wu-wien.ac.at.www > oberplag.ser.de.44909: . 1269897:1275689(5792) ack 0 win 1716 <nop,nop,timestamp 92828102 821421568>
12:58:41.251050 IP oberplag.ser.de.44909 > cran.wu-wien.ac.at.www: . ack 1265553 win 63712 <nop,nop,timestamp 821421568 92828100,nop,nop,sack sack 1 {1267001:1268449} >
12:58:41.251071 IP cran.wu-wien.ac.at.www > oberplag.ser.de.44909: . 1275689:1278585(2896) ack 0 win 1716 <nop,nop,timestamp 92828102 821421568>
12:58:41.251723 IP oberplag.ser.de.44909 > cran.wu-wien.ac.at.www: . ack 1265553 win 63712 <nop,nop,timestamp 821421568 92828100,nop,nop,sack sack 1 {1267001:1269897} >
12:58:41.251739 IP cran.wu-wien.ac.at.www > oberplag.ser.de.44909: . 1265553:1267001(1448) ack 0 win 1716 <nop,nop,timestamp 92828102 821421568>
